"id","name","name_english","father","mother","present_address","permanent_address","gender","dob","zip_code","registration_certificate_subject","registration_exam_year","registration_cetificate_no","index_no","bank_name","bank_branch","bank_account_no","designation","subject","monthly_salary_govt_provided","monthly_salary_institute_provided","gb_resolution_receive_date","gb_resolution_agenda_no","circular_paper_name","circular_published_date","recruit_approve_gbresolution_date","recruit_permit_agenda_no","recruitment_date","present_institute_join_date","present_post_join_date","dg_representative_name","dg_representative_designation","dg_representative_address","board_representative_name","board_representative_designation","board_representative_address","salary_code","manager_id","institute_id","user_id","salary_scale","recruit_exam_receive_date","time_scale_gbresolution_date","total_job_duration","current_position_job_duration","circular_paper_name","category"
1,Neil,Amos,Arden,Cecilia,"P.O. Box 196, 1122 Ullamcorper. Rd.","P.O. Box 199, 8636 Et, Avenue",Male,2016-10-29,15553-311,"facilisis. Suspendisse commodo tincidunt nibh. Phasellus nulla. Integer vulputate, risus",4,AEE0FF0B-0F5B-AF1F-3CA8-261677A9169E,41220,Chami,"Media Relations",VG7966741250590687967054,"Human Resources","lacus, varius et, euismod et, commodo at, libero. Morbi accumsan",866,38189,2016-01-25,61618,"sollicitudin a, malesuada id, erat. Etiam","2015-06-08 ",2016-02-07,82289,2016-06-12,2016-03-08,2016-09-29,Minerva,Flynn,"7828 Aliquam Av.",Cecilia,Ramirez,"Ap #662-9775 Montes, Avenue","N4P 5W7",3,2,1,"N4P 5W7",2016-09-29,2016-09-29,3,3,Cecilia,Teacher
2,Cairo,Armand,Troy,Willa,"8703 Molestie Street","544-5230 Sollicitudin St.",Female,2015-09-11,"C4N 5A8","Registration certificate subject1",8,48D8EEF8-D1C7-8749-E138-F268F774A6FE,48625,"Apple Systems","Customer Relations",MU7187357547763406709327228913,Payroll,"fames ac turpis egestas. Aliquam fringilla cursus purus. Nullam scelerisque",3129,97586,2015-04-21,61357,"diam. Duis mi","2016-09-17 ",2016-07-07,25387,2016-06-03,2015-09-15,2016-10-18,Ima,Micah,"606-3391 Feugiat. Rd.",Nissim,Carlson,"Ap #254-5948 Morbi Rd.","P2S 0V2",3,1,2,"P2S 0V2",2016-10-18,2016-10-18,3,3,Nissim,Teacher
3,Charles,Xavier,Clayton,Piper,"4220 Faucibus St.","P.O. Box 500, 4496 Eget Av.",Male,2015-11-03,"T35 1VV","feugiat non, lobortis quis, pede. Suspendisse dui. Fusce diam nunc,",5,6A5D9863-9113-E889-170E-325083D0ACB4,48756,Yahoo,"Customer Relations",HR2896785582463185029,"Legal Department","blandit. Nam nulla magna, malesuada vel, convallis in, cursus et,",70232,78621,2015-08-18,71063,"velit. Aliquam","2015-01-07 ",2015-09-02,14631,2016-05-17,2016-10-27,2015-07-11,Adam,Wesley,"Ap #240-5387 Semper St.",Kenneth,Buchanan,"Ap #340-2102 Aliquet. Av.","C4B 1J8",2,1,3,"C4B 1J8",2015-07-11,2015-07-11,2,2,Kenneth,Teacher
4,Finn,Porter,Driscoll,Daria,"4001 Eu Rd.","9346 Dui. Rd.",Female,2015-08-17,526119,"tristique senectus et netus et malesuada fames ac turpis egestas.",3,EC33411A-B0A3-1D0E-E0D6-6614D5079FB7,47612,Cakewalk,Finances,LI1237372092990402272,Accounting,"mollis nec, cursus a, enim. Suspendisse aliquet, sem ut cursus",93754,84701,2016-02-22,22337,"Nulla interdum. Curabitur dictum. Phasellus","2015-11-17 ",2015-01-18,42270,2015-08-16,2015-06-18,2016-07-14,Rowan,Allen,"P.O. Box 396, 1813 Velit St.",Reuben,Walker,"113-5007 At, Av.","U0X 5L1",2,1,4,"U0X 5L1",2016-07-14,2016-07-14,2,2,Reuben,Teacher
5,Keith,Ignatius,Uriel,Ruth,"211-6871 Dictum St.","Ap #363-7843 Tincidunt, St.",Male,2015-05-27,27214-566,"et libero. Proin mi. Aliquam gravida mauris ut mi. Duis",10,4BF80920-2C6D-3332-3619-DF161A16961C,52597,Google,"Quality Assurance",LV07EMKB1399087802958,"Tech Support","nec urna et arcu imperdiet ullamcorper. Duis at lacus. Quisque",99066,3782,2016-01-11,22505,"dolor sit amet, consectetuer adipiscing","2015-10-03 ",2014-11-15,34117,2016-03-04,2015-02-06,2016-05-08,Blaze,Hakeem,"720-3547 Sed Road",Adam,Wilson,"Ap #686-1053 Nec Rd.","P1F 4Z5",5,1,5,"P1F 4Z5",2016-05-08,2016-05-08,5,5,Adam,Teacher
6,Ferdinand,Jerome,Elmo,Xaviera,"667-2516 Aliquet St.","126-5045 Tempus Road",Male,2016-07-24,75920,"ut, sem. Nulla interdum. Curabitur dictum. Phasellus in felis. Nulla",9,0EF04380-793C-5C1F-8E96-D306B0CC2AA2,27474,Microsoft,"Media Relations",SK6138650783794073696394,"Legal Department","et risus. Quisque libero lacus, varius et, euismod et, commodo",3567,49973,2015-09-12,55569,est,"2015-11-09 ",2015-05-10,30798,2016-11-02,2015-09-22,2016-09-24,Axel,Kennedy,"P.O. Box 818, 9720 Semper Road",Indira,Stanton,"P.O. Box 390, 3090 Metus. Ave","L6G 2E8",2,1,6,"L6G 2E8",2016-09-24,2016-09-24,2,2,Indira,Teacher
7,Xenos,Ryan,Wing,Veda,"P.O. Box 934, 629 Vulputate, Rd.","8627 Sit Road",Male,2016-06-20,7735,"mauris id sapien. Cras dolor dolor, tempus non, lacinia at,",7,78AD2993-5F17-738E-5E50-1D3828948979,28278,Google,"Customer Relations",SM3499559254044720216578208,"Sales and Marketing","Etiam laoreet, libero et tristique pellentesque, tellus sem mollis dui,",16358,36242,2015-08-03,3906,"Nullam enim.","2015-03-24 ",2015-10-12,63466,2015-06-15,2015-03-27,2015-03-06,Lester,Hall,"2560 Penatibus Street",Oscar,Parrish,"REPRESENTATIVE TYPE address","U2P 7J1",2,2,7,"U2P 7J1",2015-03-06,2015-03-06,2,2,Oscar,Teacher
8,Len,James,Quamar,Aurora,"175-1183 Dolor Street","548-6296 Posuere, St.",Female,2015-11-09,651715,"Aliquam nec enim. Nunc ut erat. Sed nunc est, mollis",4,83526477-DA18-1591-A158-A17ABCF8952F,53598,Cakewalk,"Quality Assurance",EE695315500304487390,"Quality Assurance","eu lacus. Quisque imperdiet, erat nonummy ultricies ornare, elit elit",87616,96342,2015-07-11,68713,"sit amet orci. Ut","2016-08-18 ",2015-06-18,13007,2015-02-01,2015-08-17,2015-08-04,Keaton,Abbot,"Ap #136-726 Neque. Avenue",Quynn,Dyer,"8909 Morbi Ave","J6U 5S3",2,1,8,"J6U 5S3",2015-08-04,2015-08-04,2,2,Quynn,Teacher
9,Fulton,Lucian,Ryder,Genevieve,"8445 Ac Av.","803-2261 Nostra, Rd.",Female,2015-02-27,94790,"auctor ullamcorper, nisl arcu iaculis enim, sit amet ornare lectus",9,7C5EB405-50F0-26DD-9123-C84BC0CB1081,70214,Lycos,Advertising,SM7329447298969368439464177,"Media Relations","vitae velit egestas lacinia. Sed congue, elit sed consequat auctor,",66081,57699,2016-06-20,18818,"Ut tincidunt vehicula risus. Nulla","2014-12-02 ",2016-02-10,92396,2016-04-06,2015-10-26,2016-08-28,Janna,Aladdin,"6486 At, Road",Bianca,Palmer,"P.O. Box 571, 7984 Egestas. Avenue","W0C 9K6",4,1,9,"W0C 9K6",2016-08-28,2016-08-28,4,4,Bianca,Teacher
10,Aladdin,Harding,Owen,Quail,"814-8375 Fringilla. St.","P.O. Box 547, 3435 Arcu. Av.",Female,2016-06-09,60-614,"auctor quis, tristique ac, eleifend vitae, erat. Vivamus nisi. Mauris",8,A8AC5BB1-64EA-8790-5980-705AA7DC548F,34130,Cakewalk,"Research and Development",LV97JLQF1846245943002,"Quality Assurance","rutrum lorem ac risus. Morbi metus. Vivamus euismod urna. Nullam",60189,24759,2015-06-15,7577,"dui. Suspendisse ac metus vitae","2015-02-21 ",2015-05-03,74294,2015-01-27,2016-03-12,2015-11-05,Mufutau,Holmes,"8810 Nunc Av.",Cherokee,James,"4868 Convallis Rd.","M4I 2Y0",4,2,10,"M4I 2Y0",2015-11-05,2015-11-05,4,4,Cherokee,Teacher
11,Rahim,Quentin,Baker,Flavia,"P.O. Box 362, 2937 Ridiculus St.","Ap #577-7111 At Rd.",Male,2015-08-21,14388,"ac nulla. In tincidunt congue turpis. In condimentum. Donec at",8,D853579A-A3D1-6A28-2462-B0176B52946B,89203,Macromedia,"Asset Management",IL113731951574427945581,Accounting,"mi. Aliquam gravida mauris ut mi. Duis risus odio, auctor",61040,14220,2015-09-19,65774,netus,"2016-06-11 ",2015-09-28,50545,2016-06-07,2016-02-18,2016-05-15,Carissa,Felix,"Ap #114-7860 Interdum. Rd.",Bruno,Nguyen,"3417 Nisi. Road","R4E 5M6",3,2,11,"R4E 5M6",2016-05-15,2016-05-15,3,3,Bruno,Teacher
12,Leo,Thor,Preston,Adena,"839-398 Sed Rd.","Ap #717-8878 Ligula Road",Female,2015-02-26,5184FE,"mattis. Integer eu lacus. Quisque imperdiet, erat nonummy ultricies ornare,",5,56CF27C5-DB22-A1AC-7456-6C1113C9D906,47575,Google,"Customer Service",GI90RPDD744919637502858,"Customer Relations","parturient montes, nascetur ridiculus mus. Donec dignissim magna a tortor.",65743,15280,2016-08-22,24791,"In ornare sagittis felis. Donec tempor, est ac mattis","2016-04-16 ",2016-09-13,50942,2015-06-13,2016-03-05,2016-11-04,Aquila,Wade,"5219 Ipsum Rd.",Natalie,Lester,"423-4155 Libero Ave","K9Y 2T2",3,2,12,"K9Y 2T2",2016-11-04,2016-11-04,3,3,Natalie,Teacher
13,Wang,Clarke,Judah,Althea,"809-9588 Primis Rd.","Ap #710-9647 In, Avenue",Male,2016-06-15,23-990,"velit. Quisque varius. Nam porttitor scelerisque neque. Nullam nisl. Maecenas",6,8CBA97B4-DE34-55B3-6079-DF86F540263A,93105,Yahoo,"Customer Service",LT373670870396777957,"Customer Service","consectetuer rhoncus. Nullam velit dui, semper et, lacinia vitae, sodales",2952,52368,2015-10-04,30155,"enim, gravida sit amet, dapibus id, blandit at, nisi.","2015-05-01 ",2014-11-12,75519,2014-12-20,2015-08-17,2016-06-22,Odessa,Xanthus,"P.O. Box 697, 8742 Pede, Ave",Grady,Sanchez,"P.O. Box 969, 5011 Fermentum Av.","D1A 8N7",6,2,13,"D1A 8N7",2016-06-22,2016-06-22,6,6,Grady,Teacher
14,Yoshio,James,Colt,Linda,"P.O. Box 739, 4491 Tristique Rd.","491-8541 Porttitor Street",Male,2015-01-11,48782,"id risus quis diam luctus lobortis. Class aptent taciti sociosqu",3,B4ABDDED-EE9B-A5DB-89A0-DE69B444D2C3,57456,Altavista,"Legal Department",DO16521939710840506714055599,"Media Relations","est, congue a, aliquet vel, vulputate eu, odio. Phasellus at",83079,58154,2015-11-05,5358,"fringilla ornare placerat, orci lacus","2016-02-05 ",2016-07-02,83852,2016-08-12,2015-11-28,2016-01-25,Regan,Duncan,"Ap #374-8136 Ac St.",MacKenzie,Burks,"P.O. Box 927, 6279 Neque Av.","M8V 9R1",3,1,14,"M8V 9R1",2016-01-25,2016-01-25,3,3,MacKenzie,Teacher
15,Elliott,Reuben,Wesley,Kaitlin,"3729 Dictum Avenue","338-1239 Lacus Street",Female,2015-02-14,5699,"augue scelerisque mollis. Phasellus libero mauris, aliquam eu, accumsan sed,",7,05735362-C18B-67EE-BC3A-6DF5F7D4818C,59251,Adobe,"Customer Service",IS520884110008011162314444,Accounting,"bibendum ullamcorper. Duis cursus, diam at pretium aliquet, metus urna",65107,37986,2015-12-27,87375,"Proin non massa non ante bibendum ullamcorper. Duis cursus,","2015-02-07 ",2016-07-24,16710,2015-02-07,2015-04-04,2016-09-28,Bert,Tad,"P.O. Box 363, 6626 Mauris Av.",Mia,Barnett,"P.O. Box 649, 1374 Morbi Street","R1E 3Z1",3,1,15,"R1E 3Z1",2016-09-28,2016-09-28,3,3,Mia,Teacher
16,Tate,Kermit,Zane,Megan,"P.O. Box 828, 2077 Orci. Street","1618 Integer Street",Female,2015-12-31,71237,"eros non enim commodo hendrerit. Donec porttitor tellus non magna.",1,8EF87E9C-5838-E1B1-2E86-03A2D91CF48E,29003,Sibelius,"Research and Development",AT927751277692002735,"Research and Development","Curae; Donec tincidunt. Donec vitae erat vel pede blandit congue.",75338,67338,2015-03-01,84287,"nec metus facilisis lorem tristique",2015-06-26,2015-04-17,32842,2016-03-15,2016-10-15,2015-07-06,Kibo,Lionel,"Ap #462-7369 Gravida Rd.",Abel,Brady,"P.O. Box 312, 8778 Nullam Road","H1D 6H1",3,2,16,"H1D 6H1",2015-07-06,2015-07-06,3,3,Abel,Teacher
17,Boris,Harlan,Leo,Cassandra,"Ap #426-8864 Nam Rd.","531-7731 Aliquet, Avenue",Male,2016-08-12,1017,"tincidunt adipiscing. Mauris molestie pharetra nibh. Aliquam ornare, libero at",5,2DA10692-6A6F-D8F3-E983-FBC4AC5A4B08,21257,Altavista,"Human Resources",DO31944867336753945411117552,"Tech Support","cursus vestibulum. Mauris magna. Duis dignissim tempor arcu. Vestibulum ut",18984,67615,2015-10-02,38266,"risus. Donec egestas. Aliquam nec enim.","2015-12-10 ",2015-05-31,5972,2015-08-30,2016-03-16,2015-02-13,Savannah,Amos,"738-1538 A, Rd.",Ray,Brooks,"P.O. Box 886, 5500 Vestibulum Street","O3O 4J5",5,1,17,"O3O 4J5",2015-02-13,2015-02-13,5,5,Ray,Teacher
18,Norman,Nissim,Mufutau,Yen,"969 Aliquet Road","Ap #530-7504 Facilisis Rd.",Female,2015-11-10,9906,"dignissim lacus. Aliquam rutrum lorem ac risus. Morbi metus. Vivamus",7,F7A176D1-48DE-4324-56C7-89E07446C318,28301,Lavasoft,Advertising,LT408910787698777224,"Quality Assurance","nec, leo. Morbi neque tellus, imperdiet non, vestibulum nec, euismod",95569,93411,2015-01-21,22996,"Morbi vehicula. Pellentesque",2015-07-09,2016-04-21,33654,2016-02-03,2016-01-07,2015-10-16,Jasmine,Raja,"Ap #841-4156 Phasellus St.",Grady,Mcdowell,"559-3283 Et, Av.","A2R 0D0",5,1,18,"A2R 0D0",2015-10-16,2015-10-16,5,5,Grady,Teacher
19,Darius,Moses,Russell,Hayley,"355-4366 Eu Rd.","412-7207 Tristique Ave",Female,2016-07-16,"J6B 6B5","aliquet, sem ut cursus luctus, ipsum leo elementum sem, vitae",3,21F734AD-FF71-4783-F5ED-6830BA984C28,43189,Google,"Legal Department",IL122922097282667894838,Finances,"ultrices a, auctor non, feugiat nec, diam. Duis mi enim,",48799,79011,2014-11-19,49006,"Duis ac arcu. Nunc mauris. Morbi non","2015-08-07 ",2016-05-29,95336,2016-05-26,2015-06-11,2015-10-30,Evelyn,Oren,"P.O. Box 317, 6583 A, Avenue",Gwendolyn,Black,"9404 Nunc Ave","J0S 1S7",4,2,19,"J0S 1S7",2015-10-30,2015-10-30,4,4,Gwendolyn,Teacher
20,Lamar,Len,Noble,Anne,"778 Leo. Av.","Ap #534-7944 Mauris. Ave",Female,2016-01-08,129276,"a, scelerisque sed, sapien. Nunc pulvinar arcu et pede. Nunc",1,C2BACDA6-CB6D-EC2A-6143-80EB06312E2B,80280,Borland,Payroll,KZ724597766200646135,"Legal Department","adipiscing fringilla, porttitor vulputate, posuere vulputate, lacus. Cras interdum. Nunc",90471,94218,2015-07-25,94386,"risus odio, auctor vitae, aliquet nec, imperdiet","2015-12-15 ",2016-03-03,61642,2016-05-24,2016-10-13,2015-09-16,Dorothy,Len,"387-1570 Mauris Street",Blake,Perry,"1891 Blandit Av.","X0F 0M8",3,1,20,"X0F 0M8",2015-09-16,2015-09-16,3,3,Blake,Teacher
21,Dean,Edan,Ralph,Ulla,"920-8406 Non, Rd.","Ap #773-6635 Egestas Street",Male,2016-05-31,65564,"vitae semper egestas, urna justo faucibus lectus, a sollicitudin orci",8,BFBDE3D7-5368-941C-42D3-DD1539B1A6BA,52746,Lavasoft,"Customer Relations",AD0217739550023405425650,"Human Resources","vehicula. Pellentesque tincidunt tempus risus. Donec egestas. Duis ac arcu.",7633,29068,2015-04-16,83642,"nec, imperdiet nec, leo. Morbi neque tellus, imperdiet non, vestibulum","2016-01-16 ",2016-10-26,59526,2015-06-09,2016-10-01,2016-08-08,Tara,Gray,"P.O. Box 184, 6696 Ut Rd.",Xena,Moreno,"432-7994 Ligula Ave","Z4C 0J8",3,2,21,"Z4C 0J8",2016-08-08,2016-08-08,3,3,Xena,Teacher
22,Xander,Thor,Nolan,Juliet,"377-1339 Dolor. Road","421-120 Sagittis Street",Male,2015-06-14,41117-095,"augue porttitor interdum. Sed auctor odio a purus. Duis elementum,",6,F7ABDDD6-4BAA-AB07-43E4-2AA3657EFEE4,92480,Yahoo,"Tech Support",LT189752664664098189,"Human Resources","fringilla purus mauris a nunc. In at pede. Cras vulputate",54925,53911,2015-05-11,72961,"fermentum metus. Aenean sed pede nec",2016-08-19,2015-09-22,52181,2016-08-01,2016-01-06,2015-07-05,Whitney,Melvin,"690 Non Av.",Keefe,Wilkins,"8886 Sem Street","E6P 8V1",2,2,22,"E6P 8V1",2015-07-05,2015-07-05,2,2,Keefe,Teacher
23,Dale,Griffin,Kelly,Macey,"305-8129 Egestas. Road","P.O. Box 283, 7040 Non, St.",Male,2014-11-09,98352-929,"nunc id enim. Curabitur massa. Vestibulum accumsan neque et nunc.",9,5A4FCA44-F803-C2EE-80FC-80C40781753E,74502,Yahoo,Advertising,SE4422034370261390155466,"Customer Service","natoque penatibus et magnis dis parturient montes, nascetur ridiculus mus.",40432,44855,2015-07-09,31805,"Phasellus in felis. Nulla tempor augue ac ipsum. Phasellus","2015-03-10 ",2015-05-28,87104,2015-06-29,2014-12-12,2016-05-06,Lisandra,Samuel,"Ap #556-9463 Quisque Ave",Benedict,Dillard,"3858 Tristique Ave","Y7A 5F4",2,1,23,"Y7A 5F4",2016-05-06,2016-05-06,2,2,Benedict,Teacher
24,Aaron,Uriah,Kane,Jaden,"4623 Lorem Avenue","1769 Arcu Street",Female,2015-03-17,"LP86 1PJ","a purus. Duis elementum, dui quis accumsan convallis, ante lectus",6,31678397-E7A7-D427-E7F1-5E95D9805E61,43365,Borland,"Quality Assurance",GE83526987675758956895,Accounting,"gravida mauris ut mi. Duis risus odio, auctor vitae, aliquet",33734,26050,2016-09-19,40099,"mattis. Cras","2016-04-23 ",2015-07-31,21260,2016-05-27,2016-07-05,2016-04-23,Herrod,Uriel,"P.O. Box 794, 8663 Aliquam St.",Adrian,Pruitt,"P.O. Box 685, 3236 Tincidunt St.","H4P 8D6",5,1,24,"H4P 8D6",2016-04-23,2016-04-23,5,5,Adrian,Teacher
25,Ezekiel,Keefe,Adrian,Olympia,"P.O. Box 190, 6562 Molestie Rd.","Ap #664-8906 Purus. Rd.",Male,2015-03-12,121884,"nibh sit amet orci. Ut sagittis lobortis mauris. Suspendisse aliquet",3,BE57538F-CE71-8A97-DA16-8E53960E6DB1,23833,Lavasoft,"Quality Assurance",FR5421229921607764469308890,"Public Relations","fermentum convallis ligula. Donec luctus aliquet odio. Etiam ligula tortor,",15788,87793,2014-11-08,65660,"Curabitur egestas nunc sed libero. Proin sed","2015-07-16 ",2014-11-25,47974,2016-07-29,2015-07-25,2016-04-01,Shelley,Eric,"1288 Mattis Ave",Kaye,Valencia,"Ap #188-6450 Sed Ave","B5B 7R9",2,1,25,"B5B 7R9",2016-04-01,2016-04-01,2,2,Kaye,Teacher
26,Ulric,Raymond,Kenneth,Wanda,"P.O. Box 199, 9156 Nec Rd.","P.O. Box 666, 9160 Nec, St.",Male,2016-10-15,883642,"lacinia at, iaculis quis, pede. Praesent eu dui. Cum sociis",7,18F41268-6483-FE73-F52D-D0876227C233,74791,"Apple Systems","Asset Management",LB44591805512348522058276592,Payroll,"mi pede, nonummy ut, molestie in, tempus eu, ligula. Aenean",56163,85377,2016-10-02,72282,"sem ut","2016-05-30 ",2015-08-26,83208,2016-01-20,2015-10-28,2016-02-02,Kiayada,Cedric,"305-9314 Lacinia Rd.",Ignacia,Arnold,"3209 Auctor Rd.","T7D 7B4",2,1,26,"T7D 7B4",2016-02-02,2016-02-02,2,2,Ignacia,Teacher
27,Jermaine,Tad,Gabriel,Reagan,"9043 Orci Ave","P.O. Box 896, 5426 Condimentum. Rd.",Female,2016-01-05,"Y8H 6P5","egestas. Aliquam nec enim. Nunc ut erat. Sed nunc est,",9,876FAD4E-FB17-1E23-7887-E1733F877552,40900,Macromedia,"Quality Assurance",VG1869784485703502025996,Advertising,"vestibulum, neque sed dictum eleifend, nunc risus varius orci, in",25276,77063,2016-04-05,95518,"in consectetuer ipsum nunc id enim. Curabitur massa. Vestibulum","2015-02-19 ",2016-03-03,28823,2015-12-28,2015-01-29,2016-02-03,Lucy,Emmanuel,"374 Quis, Road",Tatiana,Pennington,"Ap #431-419 Arcu. Rd.","R4Z 2O0",2,1,27,"R4Z 2O0",2016-02-03,2016-02-03,2,2,Tatiana,Teacher
28,Mohammad,Howard,Kasper,Shafira,"5905 Sit Street","P.O. Box 447, 5763 Orci, Street",Male,2015-09-05,18717,"enim consequat purus. Maecenas libero est, congue a, aliquet vel,",2,81B4C7E2-8F9E-2935-C5E1-DD705587AF38,7624,Adobe,"Legal Department",GB08WVFS22076472476860,"Public Relations","non, hendrerit id, ante. Nunc mauris sapien, cursus in, hendrerit",46033,4974,2016-06-06,42928,"et libero. Proin mi. Aliquam gravida mauris ut","2016-10-08 ",2015-08-30,38456,2016-07-29,2016-01-10,2015-10-18,Walker,Isaiah,"P.O. Box 690, 3306 Ipsum. Road",Upton,Delgado,"P.O. Box 208, 8793 Erat Ave","G6W 0F0",4,2,28,"G6W 0F0",2015-10-18,2015-10-18,4,4,Upton,Teacher
29,Tucker,Armando,Myles,Signe,"313-4396 Vel, Ave","820-8458 Ornare, Rd.",Female,2015-09-16,51802,"Praesent eu dui. Cum sociis natoque penatibus et magnis dis",3,F36FC72E-7CC0-149E-DBBE-2F4BC97CCBAB,11930,"Apple Systems","Tech Support",NO3347821118465,"Research and Development","iaculis enim, sit amet ornare lectus justo eu arcu. Morbi",36555,27881,2015-10-02,73720,"viverra. Maecenas iaculis aliquet diam. Sed diam","2015-01-01 ",2015-09-12,72900,2015-02-07,2016-01-06,2015-08-23,Jael,Dillon,"638-9579 Ligula. Rd.",Blaine,Anthony,"7179 Auctor Avenue","X8O 0U1",4,1,29,"X8O 0U1",2015-08-23,2015-08-23,4,4,Blaine,Staff
30,Derek,Beau,Nicholas,Meredith,"194-9038 At Avenue","P.O. Box 623, 1598 Mauris Rd.",Male,2014-12-07,20015,"auctor, velit eget laoreet posuere, enim nisl elementum purus, accumsan",8,AC5E6E06-CAA7-A14F-E8F6-A3F2566301AD,46657,Finale,"Media Relations",AZ17084125182776856512135606,"Asset Management","ultrices iaculis odio. Nam interdum enim non nisi. Aenean eget",3261,96977,2015-09-07,89026,"sociis natoque penatibus et magnis dis parturient montes,","2014-11-26 ",2016-05-05,90901,2015-03-11,2015-06-19,2015-06-13,Alea,Lev,"968-7794 Facilisis. Av.",Dean,Hale,"Ap #840-8139 Elit, Av.","Z7M 7U6",3,2,30,"Z7M 7U6",2015-06-13,2015-06-13,3,3,Dean,Staff
31,Tucker,Hamish,Baxter,Naida,"4926 Magnis Road","644-646 Molestie. Avenue",Male,2016-09-21,7806,"varius orci, in consequat enim diam vel arcu. Curabitur ut",1,B6F8007F-5CED-C8C8-1CF6-6C941050FC43,46797,Microsoft,"Customer Relations",GI04VAJL382239931717183,Advertising,"in, cursus et, eros. Proin ultrices. Duis volutpat nunc sit",14293,95105,2016-05-05,51171,"massa. Suspendisse eleifend. Cras sed leo.","2015-04-06 ",2016-10-13,52957,2015-11-26,2015-10-09,2015-04-21,Amos,Silas,"P.O. Box 999, 8547 Facilisis, Av.",Amal,Bradshaw,"6015 Blandit St.","O0G 0N4",3,2,31,"O0G 0N4",2015-04-21,2015-04-21,3,3,Amal,Staff
32,Jerry,Camden,Grady,Shelby,"421-8346 In, Av.","289-1101 Sed Avenue",Female,2016-02-02,87634,"dictum ultricies ligula. Nullam enim. Sed nulla ante, iaculis nec,",6,6B815E6F-1D8F-D742-6D62-BB1B4061FB87,93929,Borland,"Quality Assurance",AZ92133531468737231496606905,Advertising,"nec tempus scelerisque, lorem ipsum sodales purus, in molestie tortor",65058,59763,2015-06-22,28053,"feugiat tellus lorem eu metus.","2016-10-14 ",2016-01-13,35130,2016-05-10,2015-01-06,2015-06-10,Cairo,Samuel,"Ap #268-5985 Mus. Rd.",Plato,Huffman,"P.O. Box 632, 2608 Non St.","O7W 9O7",6,2,32,"O7W 9O7",2015-06-10,2015-06-10,6,6,Plato,Staff
33,Kasper,Ashton,Mohammad,Freya,"501-7778 Sodales St.","Ap #936-1214 Mauris Av.",Male,2015-10-05,82367-218,"enim mi tempor lorem, eget mollis lectus pede et risus.",8,06813F67-A32B-995C-9AF7-4853BC343C0D,71203,Cakewalk,"Human Resources",HU07150279951667503924841226,"Research and Development","risus. Donec egestas. Aliquam nec enim. Nunc ut erat. Sed",63162,29315,2015-02-25,36287,"sed sem egestas blandit. Nam nulla magna, malesuada","2015-10-11 ",2016-08-05,56425,2015-03-09,2016-01-16,2015-07-25,Rebecca,Coby,"Ap #251-8512 Enim. Rd.",TaShya,Holder,"Ap #609-512 Dolor Avenue","Z6U 2K6",3,2,33,"Z6U 2K6",2015-07-25,2015-07-25,3,3,TaShya,Staff
34,Kirk,Bradley,Daquan,Doris,"1369 Odio Street","3809 Non St.",Female,2015-01-29,47632-581,"convallis dolor. Quisque tincidunt pede ac urna. Ut tincidunt vehicula",5,E90395F2-4221-3775-BBFC-452134E4EA8A,56009,Altavista,Payroll,LI4316969025484409313,"Public Relations","pede et risus. Quisque libero lacus, varius et, euismod et,",20635,25385,2015-07-08,53915,"Nulla tincidunt, neque vitae semper","2015-02-15 ",2016-10-31,55987,2015-10-12,2015-05-21,2015-04-29,Justine,Julian,"Ap #385-3440 Enim, St.",Imelda,Flowers,"Ap #876-7796 Facilisis Ave","P2N 1L8",3,2,34,"P2N 1L8",2015-04-29,2015-04-29,3,3,Imelda,Staff
35,Octavius,Andrew,Murphy,Meghan,"Ap #989-4709 Dui. Ave","Ap #785-2755 Consequat St.",Male,2016-04-15,952337,"quis accumsan convallis, ante lectus convallis est, vitae sodales nisi",1,A2F109BA-AE72-8917-EFC6-9F6CF57D0C08,73679,Adobe,"Customer Service",BE47014208188228,Advertising,"ac turpis egestas. Aliquam fringilla cursus purus. Nullam scelerisque neque",26905,54646,2015-05-12,95619,auctor,"2016-01-16 ",2015-03-25,20990,2015-05-16,2015-01-12,2015-05-31,Amethyst,Marsden,"6904 Cras Av.",Darius,Galloway,"4028 Luctus. Rd.","J9L 3Y6",3,1,35,"J9L 3Y6",2015-05-31,2015-05-31,3,3,Darius,Staff
36,Palmer,Zeus,Byron,Chiquita,"431-9090 Luctus Road","244 Nec Ave",Female,2015-09-21,60804,"dictum sapien. Aenean massa. Integer vitae nibh. Donec est mauris,",7,70D86F0F-9C19-143D-BE7F-391F093059D6,13035,Yahoo,Payroll,NL94WMTD4988847415,"Research and Development","Nullam velit dui, semper et, lacinia vitae, sodales at, velit.",44823,30217,2014-11-21,45566,"eros nec tellus. Nunc","2015-03-09 ",2015-09-04,81650,2015-11-30,2014-12-06,2014-12-06,Nora,Callum,"4559 Vel Avenue",Dean,Rivera,"Ap #156-9432 Quisque Ave","Q8L 6I5",5,1,36,"Q8L 6I5",2014-12-06,2014-12-06,5,5,Dean,Staff
37,Yoshio,Macaulay,Erich,Charlotte,"293-9385 Penatibus Street","Ap #703-3331 Nonummy Av.",Male,2015-12-31,542783,"ante ipsum primis in faucibus orci luctus et ultrices posuere",6,3A0F7E72-CA03-714A-7ED1-504A4AF8113D,33104,Borland,"Quality Assurance",AZ54497440741521713357223134,"Quality Assurance","ligula. Aenean euismod mauris eu elit. Nulla facilisi. Sed neque.",11880,35133,2014-12-08,32768,"tincidunt, neque vitae","2015-05-02 ",2015-01-28,50148,2016-07-02,2015-03-26,2015-08-23,Kelly,Leroy,"Ap #998-1197 Elit, Rd.",Amanda,Snow,"7593 Est, Ave","S1N 4X0",5,2,37,"S1N 4X0",2015-08-23,2015-08-23,5,5,Amanda,Staff
38,Barclay,Noble,Clarke,Iliana,"P.O. Box 989, 4182 Mauris, Rd.","7607 Mauris Rd.",Male,2015-10-04,63460,"sem elit, pharetra ut, pharetra sed, hendrerit a, arcu. Sed",9,8A6A94EC-E4C3-2304-DFFA-E11F85EF9ADF,62375,Google,"Asset Management",DE46361854456214606353,"Tech Support","varius ultrices, mauris ipsum porta elit, a feugiat tellus lorem",33412,12541,2014-11-23,43588,"sodales. Mauris blandit enim consequat purus. Maecenas libero est,","2015-12-11 ",2015-07-21,14352,2015-12-19,2016-07-03,2015-12-18,Kelly,Hyatt,"P.O. Box 781, 9473 Tellus Rd.",Shaine,Waters,"Ap #408-1644 Sit Av.","Z4V 5M7",4,2,38,"Z4V 5M7",2015-12-18,2015-12-18,4,4,Shaine,Staff
39,Ira,Price,Reuben,Justine,"P.O. Box 972, 5239 Et Road","693-8000 Mauris. Avenue",Male,2016-05-21,22904,"montes, nascetur ridiculus mus. Donec dignissim magna a tortor. Nunc",5,3E11EBD6-DCA1-54BB-E41B-BF30A656F6DA,19017,Adobe,"Asset Management",AE926192555459885492928,Advertising,"ullamcorper viverra. Maecenas iaculis aliquet diam. Sed diam lorem, auctor",35998,72012,2015-04-27,92190,"erat volutpat. Nulla facilisis. Suspendisse commodo tincidunt","2015-12-26 ",2015-08-13,48423,2015-02-05,2016-01-24,2016-08-07,Mohammad,Aaron,"P.O. Box 970, 929 Imperdiet Rd.",Fiona,Hall,"4383 Hendrerit. Ave","L2O 7F9",3,2,39,"L2O 7F9",2016-08-07,2016-08-07,3,3,Fiona,Staff
