"id","name","name_english","father","mother","present_address","permanent_address","gender","dob","zip_code","registration_certificate_subject","registration_exam_year","registration_cetificate_no","index_no","bank_name","bank_branch","bank_account_no","designation","subject","monthly_salary_govt_provided","monthly_salary_institute_provided","gb_resolution_receive_date","gb_resolution_agenda_no","circular_paper_name","circular_published_date","recruit_approve_gbresolution_date","recruit_permit_agenda_no","recruitment_date","present_institute_join_date","present_post_join_date","dg_representative_name","dg_representative_designation","dg_representative_address","board_representative_name","board_representative_designation","board_representative_address","salary_code","manager_id","institute_id","user_id","salary_scale","recruit_exam_receive_date","time_scale_gbresolution_date","total_job_duration","current_position_job_duration","circular_paper_name","category"
40,Abbot,Craig,Bruce,Jescie,"Ap #620-6540 Lectus Avenue","Ap #319-2845 Sapien. Road",Female,2016-08-25,9714,"in, hendrerit consectetuer, cursus et, magna. Praesent interdum ligula eu",10,CC932B89-21EE-E117-0943-F6DE0E1346C0,86302,Sibelius,Accounting,AD4689449131463095883136,Accounting,"Donec tempor, est ac mattis semper, dui lectus rutrum urna,",15813,45777,2016-03-22,49789,"lacus. Cras interdum.","2015-09-25 ",2016-01-25,51947,2015-08-20,2016-08-26,2016-09-05,Jenna,Lamar,"437-8804 Pede. St.",Chaim,Hodges,"8014 Tristique St.","U8Y 1F2",3,1,40,"U8Y 1F2",2016-09-05,2016-09-05,3,3,Chaim,Staff
41,Kato,Francis,Salvador,Gretchen,"Ap #983-321 Eleifend. Rd.","986-6465 Eu Ave",Male,2016-08-18,56890,"mollis. Integer tincidunt aliquam arcu. Aliquam ultrices iaculis odio. Nam",10,63308321-56DC-A9C4-5170-1C44ACA7BE18,24941,Microsoft,"Customer Service",IE38CUHP15921013514878,"Quality Assurance","nisl. Maecenas malesuada fringilla est. Mauris eu turpis. Nulla aliquet.",49143,64224,2016-02-02,63935,"Sed pharetra, felis eget varius ultrices, mauris","2016-04-20 ",2015-01-01,12411,2016-04-04,2016-07-16,2016-06-06,Charity,Grady,"Ap #546-1874 A Road",Thane,Beck,"P.O. Box 486, 2220 Cum Av.","Y3O 4S4",2,1,41,"Y3O 4S4",2016-06-06,2016-06-06,2,2,Thane,Staff
42,Marsden,Oleg,Mark,Lydia,"Ap #970-3635 Sit Road","592-6153 Hendrerit St.",Male,2016-07-22,920835,"vulputate eu, odio. Phasellus at augue id ante dictum cursus.",2,1294E24C-0AE5-A047-9508-4AA3EA4AF857,82485,Adobe,"Media Relations",ME65088668717512963268,"Media Relations","dictum placerat, augue. Sed molestie. Sed id risus quis diam",68529,7773,2015-02-02,62357,"aptent taciti sociosqu ad litora torquent per conubia","2016-05-30 ",2015-03-03,15501,2016-03-15,2015-04-18,2014-12-18,Charissa,Martin,"P.O. Box 197, 2155 A Avenue",Maggy,Kaufman,"876-4915 Eros. Road","J1V 5C6",2,1,42,"J1V 5C6",2014-12-18,2014-12-18,2,2,Maggy,Staff
43,Justin,Dale,Gannon,Hyacinth,"Ap #671-4591 Nulla Avenue","593-5802 Aliquet. St.",Female,2016-03-07,58-816,"enim. Etiam gravida molestie arcu. Sed eu nibh vulputate mauris",7,858BB6FA-E71C-89E0-A97A-73061D89B2F9,52439,Cakewalk,"Quality Assurance",MK06837872485636233,"Public Relations","Quisque libero lacus, varius et, euismod et, commodo at, libero.",26004,91712,2015-01-09,29390,"morbi tristique","2016-03-31 ",2015-09-30,87060,2016-03-28,2015-09-18,2016-03-27,Ezra,Jelani,"343-1633 Consectetuer Street",Victor,Acevedo,"7984 Vitae, St.","L7I 0Y5",5,2,43,"L7I 0Y5",2016-03-27,2016-03-27,5,5,Victor,Staff
44,Moses,Tobias,Justin,Francesca,"Ap #130-8647 Nonummy Ave","717-9842 Enim, Street",Female,2015-11-22,28714,"Suspendisse aliquet molestie tellus. Aenean egestas hendrerit neque. In ornare",8,F4F39069-EF9C-DEF8-79CB-BEBFD951317D,77348,Altavista,"Customer Service",BG42RHHY81696694958735,"Human Resources","neque. Nullam ut nisi a odio semper cursus. Integer mollis.",46776,14567,2015-03-17,70687,"velit in aliquet lobortis, nisi nibh lacinia orci, consectetuer euismod","2016-06-02 ",2015-09-17,59724,2015-12-28,2015-04-29,2016-07-19,Maxine,Griffith,"P.O. Box 524, 1162 Purus. Av.",Faith,Velasquez,"1320 Et Avenue","X5Z 5B7",2,1,44,"X5Z 5B7",2016-07-19,2016-07-19,2,2,Faith,Staff
45,Quinlan,Clarke,Ethan,Yolanda,"7698 In Avenue","P.O. Box 442, 7166 Quam Road",Male,2015-01-13,5929HW,"id, blandit at, nisi. Cum sociis natoque penatibus et magnis",9,1CCF8E1B-F1B7-096F-A20D-072E132F4A2A,95683,Lavasoft,"Customer Relations",AZ65056089193370851129645766,Finances,"nibh enim, gravida sit amet, dapibus id, blandit at, nisi.",31738,40644,2015-09-17,36504,"ipsum. Curabitur consequat, lectus sit","2016-04-30 ",2015-08-05,40838,2016-03-27,2015-05-17,2016-08-26,September,Maxwell,"P.O. Box 372, 1890 Fringilla, Rd.",Xandra,Mcdaniel,"571-1971 Sit Avenue","M2M 3M6",2,1,45,"M2M 3M6",2016-08-26,2016-08-26,2,2,Xandra,Staff
46,Beau,Nero,Nehru,Hillary,"Ap #636-9360 Mauris St.","5374 Ullamcorper, Ave",Female,2014-11-28,7902,"non, vestibulum nec, euismod in, dolor. Fusce feugiat. Lorem ipsum",5,94567FB5-ACB0-07C3-E7A4-6CB9C02F481F,37090,Lycos,"Research and Development",GT63466884163889200861363740,"Public Relations","nulla ante, iaculis nec, eleifend non, dapibus rutrum, justo. Praesent",31709,35934,2015-07-28,96881,"risus. Morbi metus.","2016-02-23 ",2014-12-13,36966,2015-11-20,2015-12-01,2016-04-01,Rigel,Wylie,"819 Odio. Avenue",Kimberly,Davis,"Ap #264-8951 Nulla. Ave","Q0J 7N8",2,2,46,"Q0J 7N8",2016-04-01,2016-04-01,2,2,Kimberly,Staff
47,Elton,Kenneth,Preston,Helen,"P.O. Box 555, 1458 Dui St.","Ap #985-547 Luctus Street",Male,2016-10-10,3197,"consequat auctor, nunc nulla vulputate dui, nec tempus mauris erat",1,9698F2B9-8B61-C435-3F74-6D6B115DE4DF,25792,Finale,"Media Relations",MU7558695526422200425377136011,"Sales and Marketing","augue scelerisque mollis. Phasellus libero mauris, aliquam eu, accumsan sed,",46790,33009,2015-05-13,5346,"rutrum urna, nec luctus felis","2015-06-29 ",2015-06-29,16452,2015-07-13,2015-12-03,2016-04-28,Travis,Forrest,"138-6041 Quam Street",Aline,Vang,"9059 Sem Rd.","O5I 1C4",4,1,47,"O5I 1C4",2016-04-28,2016-04-28,4,4,Aline,Staff
48,Graham,Samuel,Gary,Kay,"2516 Dictum Av.","4257 Mi Road",Male,2015-03-29,88284-937,"scelerisque mollis. Phasellus libero mauris, aliquam eu, accumsan sed, facilisis",1,1D8D40FF-DD0F-F42E-D5C8-DC714CD366C6,83766,Finale,"Sales and Marketing",KW7126316460578787224751936740,"Media Relations","Donec vitae erat vel pede blandit congue. In scelerisque scelerisque",75446,93656,2016-03-09,195,"a tortor. Nunc commodo","2016-01-03 ",2015-10-28,92250,2015-01-07,2016-08-12,2015-08-28,Hammett,Barclay,"292-9153 Quisque Ave",Whilemina,Downs,"Ap #299-2864 Lacus. Rd.","Q6C 3X7",4,2,48,"Q6C 3X7",2015-08-28,2015-08-28,4,4,Whilemina,Staff
49,Hiram,Nathaniel,Christian,Christine,"8823 Ornare Street","488-1849 Posuere Road",Female,2015-06-18,"M4 2RA","porttitor scelerisque neque. Nullam nisl. Maecenas malesuada fringilla est. Mauris",4,60076E9D-A226-EB74-54B3-6309D7F61CAB,43428,Cakewalk,Finances,BH92123458739724752582,"Customer Service","et tristique pellentesque, tellus sem mollis dui, in sodales elit",30851,81936,2016-04-26,89490,felis.,"2016-04-03 ",2016-09-01,57853,2015-04-17,2015-03-16,2015-02-20,Marsden,Kenneth,"P.O. Box 409, 3602 Mi St.",Griffin,Moon,"Ap #105-8227 Metus Av.","N5V 8F9",3,2,49,"N5V 8F9",2015-02-20,2015-02-20,3,3,Griffin,Staff
50,Asher,Tanner,Elmo,Lilah,"P.O. Box 223, 2059 Penatibus Av.","Ap #777-1361 Scelerisque St.",Female,2016-06-28,67997,"nulla vulputate dui, nec tempus mauris erat eget ipsum. Suspendisse",3,7C7BB5F0-B476-AC3C-C052-5BA98D11F5F4,16444,Altavista,"Human Resources",PK2818211799576990201021,Advertising,"ante. Vivamus non lorem vitae odio sagittis semper. Nam tempor",52417,89222,2015-11-09,19307,"Duis a mi fringilla mi lacinia mattis. Integer eu lacus.","2015-09-17 ",2015-04-19,80468,2015-08-08,2015-03-23,2016-04-07,Raphael,Warren,"9238 Eu Road",Thane,Carr,"930-9763 Accumsan St.","N2O 4H2",3,1,50,"N2O 4H2",2016-04-07,2016-04-07,3,3,Thane,Staff
51,Ethan,Jack,Nash,Jena,"618-2113 Felis. Road","2077 Ligula St.",Female,2016-02-17,3483,"lorem ut aliquam iaculis, lacus pede sagittis augue, eu tempor",2,1D4E0FE1-E2AF-8001-45B3-FF424F524C0C,49864,Sibelius,"Tech Support",ME26872459036865132725,"Customer Service","magna et ipsum cursus vestibulum. Mauris magna. Duis dignissim tempor",84140,79048,2015-08-04,60501,"purus. Duis elementum,","2015-09-07 ",2015-12-23,6040,2016-03-02,2016-06-04,2016-01-12,Denton,Philip,"171-3914 Vel St.",Tanner,Britt,"875-5773 Erat. Ave","B1B 1K9",6,2,51,"B1B 1K9",2016-01-12,2016-01-12,6,6,Tanner,Staff
52,Duncan,Kennedy,Norman,Ruby,"762-1122 Vulputate, Rd.","375-4766 Sem Street",Female,2015-09-06,215735,"dignissim pharetra. Nam ac nulla. In tincidunt congue turpis. In",6,76892DBB-059D-35FC-DC42-81C1A9096364,82984,Lavasoft,Payroll,VG8359583940351774156703,"Legal Department","nascetur ridiculus mus. Aenean eget magna. Suspendisse tristique neque venenatis",62932,47887,2015-03-28,53382,"tellus. Suspendisse sed dolor. Fusce mi lorem, vehicula et, rutrum","2016-06-29 ",2016-03-20,15505,2016-04-04,2015-10-13,2016-07-10,Iris,Rudyard,"P.O. Box 447, 9963 Ut, Avenue",Coby,Alford,"Ap #912-3735 Augue, St.","F4Y 8Q7",3,2,52,"F4Y 8Q7",2016-07-10,2016-07-10,3,3,Coby,Staff
53,Jerry,Maxwell,Basil,MacKenzie,"929 Nisi. Street","313-1459 Nulla. Rd.",Male,2015-05-08,8189,"Aliquam adipiscing lobortis risus. In mi pede, nonummy ut, molestie",5,069BDF7B-2EE2-7B32-C57C-894D74975B2F,14275,Borland,"Quality Assurance",AL89149942904550888731313408,"Sales and Marketing","malesuada fames ac turpis egestas. Fusce aliquet magna a neque.",43164,69150,2015-12-10,85676,"est. Mauris eu turpis. Nulla aliquet. Proin velit. Sed malesuada","2015-07-30 ",2015-10-21,90153,2016-06-12,2014-12-15,2016-02-07,Zeph,Erasmus,"8785 Mollis Rd.",Hanae,Avila,"Ap #263-9309 Posuere Ave","I7Z 5V4",3,1,53,"I7Z 5V4",2016-02-07,2016-02-07,3,3,Hanae,Staff
54,Dane,Solomon,Upton,Lenore,"P.O. Box 163, 7577 Sit Ave","287-1738 Neque. Rd.",Female,2016-10-19,95293,"eu tellus eu augue porttitor interdum. Sed auctor odio a",4,37839946-2AEF-87A8-32EC-DC83060BFB9B,45521,Macromedia,"Sales and Marketing",GT12287891511850135202359766,"Customer Relations","Ut nec urna et arcu imperdiet ullamcorper. Duis at lacus.",14736,36141,2016-03-27,23379,dolor.,"2016-05-28 ",2016-08-18,67215,2016-01-24,2016-09-12,2015-09-13,Imani,Carter,"Ap #622-9275 Lorem, Rd.",Amy,Clay,"271-5989 Adipiscing Ave","W6L 5X3",3,1,54,"W6L 5X3",2015-09-13,2015-09-13,3,3,Amy,Staff
55,Xenos,Kasper,Oleg,Cleo,"P.O. Box 718, 9615 Dis St.","Ap #421-9399 Morbi St.",Male,2015-01-29,03403-455,"quam a felis ullamcorper viverra. Maecenas iaculis aliquet diam. Sed",4,8F2898E9-0A63-0B01-D9ED-AAFA2ECCB555,38820,Lycos,"Quality Assurance",MD2214898974514374217993,"Media Relations","Vivamus non lorem vitae odio sagittis semper. Nam tempor diam",20773,78748,2015-04-17,59665,"magna. Sed eu eros.","2016-09-05 ",2015-10-10,73142,2014-12-30,2016-05-19,2014-11-10,Imogene,Hector,"199-1481 Convallis St.",Flavia,Solis,"543-9493 Et, St.","E0D 0M6",5,1,55,"E0D 0M6",2014-11-10,2014-11-10,5,5,Flavia,Staff
56,Linus,Damon,Axel,Rhoda,"Ap #413-9981 Amet, Rd.","Ap #358-7051 Imperdiet Av.",Female,2015-07-21,"E4P 3J1","Donec nibh. Quisque nonummy ipsum non arcu. Vivamus sit amet",4,2237BCD2-8866-D5AD-AB88-CECB6B30E342,68655,Adobe,Accounting,EE137432190342891612,"Customer Service","lorem vitae odio sagittis semper. Nam tempor diam dictum sapien.",33432,67906,2015-03-02,51522,"velit egestas lacinia. Sed congue, elit","2015-07-05 ",2016-02-12,23629,2016-03-17,2016-07-21,2015-01-20,Davis,Beau,"922-3026 Tristique Street",Elaine,Gray,"P.O. Box 936, 3979 Vulputate, Avenue","I2E 2W0",5,1,56,"I2E 2W0",2015-01-20,2015-01-20,5,5,Elaine,Staff
57,Uriel,Quinlan,Avram,Shelly,"8082 Malesuada St.","P.O. Box 998, 3253 Quisque Ave",Male,2016-10-06,82172,"sit amet lorem semper auctor. Mauris vel turpis. Aliquam adipiscing",2,79060171-27DC-6D47-2D72-225740503B27,54255,Macromedia,"Media Relations",VG1733083382350815632161,"Human Resources","Sed congue, elit sed consequat auctor, nunc nulla vulputate dui,",91721,55916,2016-02-18,39406,"ultricies dignissim lacus. Aliquam rutrum lorem ac","2015-01-20 ",2016-11-01,5036,2015-07-18,2015-03-20,2015-02-10,Barclay,Alvin,"Ap #278-2848 Est, Ave",Kiayada,Stokes,"P.O. Box 731, 3635 Ut Street","N1U 5A5",4,1,57,"N1U 5A5",2015-02-10,2015-02-10,4,4,Kiayada,Staff
58,Quinn,Roth,Martin,Grace,"Ap #689-2532 Magnis St.","281-6348 Velit Road",Female,2015-11-20,36455,"mauris sagittis placerat. Cras dictum ultricies ligula. Nullam enim. Sed",9,A7550FD8-D0ED-DCC1-AA03-CEACFDFB9BC7,13847,Sibelius,"Sales and Marketing",LU740264664704974743,Finances,"magna a neque. Nullam ut nisi a odio semper cursus.",53683,94317,2015-07-13,64728,"risus odio, auctor vitae, aliquet nec, imperdiet","2016-10-06 ",2016-02-26,37388,2015-10-06,2015-07-29,2016-04-30,Samuel,Harper,"2995 Ipsum Road",Fritz,Burke,"620 Donec Road","L1T 8R0",3,2,58,"L1T 8R0",2016-04-30,2016-04-30,3,3,Fritz,Staff
59,Edan,Cyrus,Jordan,Zoe,"Ap #158-8432 Mattis St.","Ap #331-7218 Amet Rd.",Female,2015-01-16,"K2Z 3R9","Donec est mauris, rhoncus id, mollis nec, cursus a, enim.",3,F76663B0-70D6-B31A-2A62-56BE4C3F4181,93201,Lavasoft,"Media Relations",TN3346577679062138594299,"Research and Development","urna convallis erat, eget tincidunt dui augue eu tellus. Phasellus",12543,26182,2016-04-23,86697,"lobortis mauris. Suspendisse aliquet molestie tellus. Aenean","2015-03-06 ",2015-11-22,7702,2014-12-15,2015-02-28,2015-01-30,Aidan,Mark,"701-7702 Amet St.",Wing,Foley,"325-6424 Nonummy. Street","B7C 9B5",3,1,59,"B7C 9B5",2015-01-30,2015-01-30,3,3,Wing,Staff
60,Edan,Davis,Caesar,Tasha,"Ap #347-1029 Nulla. Av.","P.O. Box 953, 551 Sed, Rd.",Female,2014-12-14,850249,"consectetuer ipsum nunc id enim. Curabitur massa. Vestibulum accumsan neque",4,4B98F72F-E612-E6BF-CDD6-5E4424575DA6,67188,Lavasoft,Advertising,PT35438478546086026735196,"Quality Assurance","mauris. Suspendisse aliquet molestie tellus. Aenean egestas hendrerit neque. In",48107,30191,2016-01-12,33965,"Fusce fermentum fermentum arcu. Vestibulum ante ipsum","2015-10-16 ",2015-11-20,40024,2015-05-24,2014-11-23,2015-09-03,Cheyenne,Driscoll,"3501 Adipiscing, Avenue",Sarah,Livingston,"4538 Odio. Street","Q9D 3F2",2,1,60,"Q9D 3F2",2015-09-03,2015-09-03,2,2,Sarah,Staff
61,Garth,Fitzgerald,Dustin,Blythe,"Ap #381-6764 Enim, St.","P.O. Box 570, 7386 Eu, Rd.",Female,2015-01-24,46001,"orci sem eget massa. Suspendisse eleifend. Cras sed leo. Cras",8,EDEEA8DB-D937-BB09-03A9-4154721048D0,4168,Cakewalk,"Customer Service",BE81474055321995,"Quality Assurance","libero mauris, aliquam eu, accumsan sed, facilisis vitae, orci. Phasellus",22414,90443,2016-10-30,42403,enim,"2016-06-18 ",2016-02-01,15155,2015-09-21,2015-12-30,2014-12-19,Brian,Laith,"P.O. Box 668, 7709 Id, Ave",Justina,Lane,"P.O. Box 338, 8620 Euismod Street","D7D 3A6",2,1,61,"D7D 3A6",2014-12-19,2014-12-19,2,2,Justina,Staff
62,Odysseus,Mark,Magee,Pearl,"P.O. Box 212, 1615 Proin Rd.","5563 Dui, Road",Male,2015-12-19,70914,"sagittis felis. Donec tempor, est ac mattis semper, dui lectus",1,CF259A18-B0CB-5994-1EE6-9BA81FBD0FD8,23315,Yahoo,"Customer Relations",NL20EVIW2673644566,"Media Relations","non justo. Proin non massa non ante bibendum ullamcorper. Duis",59239,65637,2014-12-13,24117,"imperdiet,","2015-08-10 ",2015-02-01,66634,2016-10-17,2016-08-21,2016-09-19,Amanda,Isaiah,"P.O. Box 399, 5643 Et, Street",Meredith,Owen,"Ap #340-4657 Mattis Av.","S7P 7D5",5,2,62,"S7P 7D5",2016-09-19,2016-09-19,5,5,Meredith,Staff
63,Armando,Dominic,Abdul,Fredericka,"P.O. Box 900, 2792 Erat St.","3769 Neque. St.",Male,2015-09-29,63-431,"sodales elit erat vitae risus. Duis a mi fringilla mi",9,D866EDEB-41E4-D855-6064-3AC72DFBA55F,35235,Finale,"Public Relations",SM6975749681769496565001093,"Quality Assurance","consequat auctor, nunc nulla vulputate dui, nec tempus mauris erat",19149,51234,2015-06-23,79741,"nonummy. Fusce fermentum fermentum arcu. Vestibulum ante ipsum","2015-06-23 ",2015-03-22,91298,2016-04-11,2015-05-16,2015-07-25,Samantha,Jeremy,"P.O. Box 222, 5174 Nonummy Rd.",Joelle,Hurst,"824-3868 Mauris. Rd.","I1M 7Q1",2,1,63,"I1M 7Q1",2015-07-25,2015-07-25,2,2,Joelle,Staff
64,Gary,Jordan,Upton,Lani,"955-5002 Egestas St.","P.O. Box 702, 3288 Aenean Rd.",Male,2015-03-16,28502,"sit amet, consectetuer adipiscing elit. Curabitur sed tortor. Integer aliquam",5,AFC33E55-9DCA-FFDC-252B-992728DCEA79,82842,Altavista,Accounting,AT772778983284771585,"Sales and Marketing","id risus quis diam luctus lobortis. Class aptent taciti sociosqu",33287,985,2016-07-10,41455,"cursus vestibulum.","2016-05-21 ",2016-08-11,23858,2016-09-01,2016-06-10,2015-04-05,Blythe,Tiger,"P.O. Box 434, 7041 Cras Av.",Mark,Stuart,"Ap #990-2540 Tellus. Street","A9G 5K2",2,1,64,"A9G 5K2",2015-04-05,2015-04-05,2,2,Mark,Staff
65,Tobias,Raphael,Gareth,Sacha,"4483 Mi Street","Ap #725-783 Risus Rd.",Male,2016-03-13,57293,"molestie. Sed id risus quis diam luctus lobortis. Class aptent",10,3AC5FF3D-5405-66F3-8DF8-B6F9DEA26101,28298,Chami,"Tech Support",MK38771664699317435,Payroll,"posuere cubilia Curae; Donec tincidunt. Donec vitae erat vel pede",14345,88482,2016-04-25,11009,"enim. Etiam","2015-10-11 ",2015-01-25,95511,2016-08-20,2016-04-08,2016-01-29,Virginia,Shad,"Ap #829-7384 Nunc Avenue",Marshall,Sweeney,"Ap #932-5737 Risus. Av.","N5K 2A2",2,2,65,"N5K 2A2",2016-01-29,2016-01-29,2,2,Marshall,Staff
66,Adam,Jerome,Malcolm,Althea,"5116 Tellus Street","6019 A, Street",Female,2016-09-22,51020,"nec, diam. Duis mi enim, condimentum eget, volutpat ornare, facilisis",7,0AB70D29-AD75-4560-FF0E-10D8DC202786,71622,Lycos,"Research and Development",LB30140864860359276272071935,"Media Relations","sem ut cursus luctus, ipsum leo elementum sem, vitae aliquam",22551,88430,2014-11-11,41041,eget,"2015-08-07 ",2016-02-19,55906,2014-11-09,2016-04-13,2015-10-04,Bethany,Scott,"1923 Senectus Rd.",Cally,Solis,"Ap #106-6540 Tellus. St.","W7V 8N8",4,2,66,"W7V 8N8",2015-10-04,2015-10-04,4,4,Cally,Staff
67,Kareem,Ryder,Abel,Joelle,"569-1649 Per Rd.","P.O. Box 752, 3688 Eros Av.",Male,2016-05-25,6250GA,"metus. In nec orci. Donec nibh. Quisque nonummy ipsum non",10,E0683ACD-2FA2-F879-2D82-C70FF551110B,43939,Sibelius,"Research and Development",HU10272410028559587178411242,"Human Resources","elementum, dui quis accumsan convallis, ante lectus convallis est, vitae",50913,67767,2016-07-19,63871,"nibh. Donec est mauris, rhoncus id, mollis nec,","2016-06-02 ",2016-06-05,21233,2016-02-18,2016-03-18,2014-12-16,Galena,Sylvester,"7732 Eu St.",Sylvia,Maynard,"436-3035 Lorem Street","X0S 9U5",4,2,67,"X0S 9U5",2014-12-16,2014-12-16,4,4,Sylvia,Staff
68,Chase,Justin,Neil,Rhiannon,"919-4121 Eu, Rd.","810-9179 Pellentesque St.",Male,2015-06-24,"C7I 3US","ipsum non arcu. Vivamus sit amet risus. Donec egestas. Aliquam",4,DCCE95F0-7592-88F1-B17A-30C55BE0612A,72525,Altavista,"Legal Department",TN5959772108576364324352,"Legal Department","auctor odio a purus. Duis elementum, dui quis accumsan convallis,",98397,72497,2015-10-18,6725,molestie.,"2015-10-16 ",2016-06-25,53777,2015-01-11,2016-10-19,2015-04-29,Dominic,Nasim,"P.O. Box 664, 4159 Integer St.",Alexis,Phelps,"P.O. Box 729, 4031 Nisl. St.","M5W 9T0",3,1,68,"M5W 9T0",2015-04-29,2015-04-29,3,3,Alexis,Staff
69,Eaton,Eric,Price,Bethany,"P.O. Box 314, 1609 Vel Avenue","621-4398 A Rd.",Female,2016-09-03,757259,"cursus, diam at pretium aliquet, metus urna convallis erat, eget",9,606998F6-BB70-06B2-48DE-204F0C67675C,59294,Google,"Tech Support",FI0348730054299624,"Human Resources","risus. Quisque libero lacus, varius et, euismod et, commodo at,",92913,77768,2016-04-21,94595,"Lorem ipsum dolor sit amet, consectetuer adipiscing elit.","2015-11-05 ",2016-08-28,27713,2015-01-18,2016-01-30,2015-07-18,Marah,Joseph,"1487 Duis Rd.",Regina,Mcfadden,"Ap #206-3840 Commodo Road","S3U 2X9",3,1,69,"S3U 2X9",2015-07-18,2015-07-18,3,3,Regina,Staff
70,Jamal,Leonard,Barclay,Shaine,"Ap #193-9273 Leo. St.","Ap #549-4162 Eu Rd.",Male,2015-08-26,8794,"magna. Ut tincidunt orci quis lectus. Nullam suscipit, est ac",10,3A9CD232-1EAB-B85D-3A53-E7AA080266DD,95937,Google,Finances,BG21TYUT81765783460665,"Asset Management","Aenean eget magna. Suspendisse tristique neque venenatis lacus. Etiam bibendum",30075,16321,2016-06-22,62822,"euismod mauris eu elit. Nulla facilisi. Sed neque.","2015-08-14 ",2015-11-27,72489,2015-04-05,2015-03-11,2016-02-20,Rebecca,Emmanuel,"P.O. Box 967, 6423 Dapibus Av.",Karina,Richardson,"2701 Nulla Street","E2K 5Q2",6,1,70,"E2K 5Q2",2016-02-20,2016-02-20,6,6,Karina,Staff
71,Calvin,Kenneth,Honorato,Melanie,"P.O. Box 215, 4127 Nisl Road","Ap #796-8248 Integer Avenue",Male,2015-08-16,61849,"mattis ornare, lectus ante dictum mi, ac mattis velit justo",7,1109F5B9-DD58-C645-C3BE-CDE9E51EF1FB,14126,Altavista,"Tech Support",GI86GCZH607495012512416,"Asset Management","est arcu ac orci. Ut semper pretium neque. Morbi quis",47930,30302,2015-05-27,80705,"Integer vitae nibh.","2014-12-17 ",2015-06-20,4409,2015-04-28,2016-07-19,2015-02-28,Mohammad,Kadeem,"P.O. Box 883, 6123 Non Rd.",Uma,Avila,"416-4507 Eget St.","S4T 7W8",3,1,71,"S4T 7W8",2015-02-28,2015-02-28,3,3,Uma,Staff
72,Oscar,Gregory,Connor,Barbara,"P.O. Box 179, 1636 Blandit. Street","P.O. Box 187, 7251 Fringilla. Avenue",Male,2015-01-20,6619,"Donec dignissim magna a tortor. Nunc commodo auctor velit. Aliquam",4,E0FEA248-8B07-7B4E-FAD0-3C3D2B7E2794,15763,Lycos,"Sales and Marketing",AT319363863278409769,"Customer Service","est, vitae sodales nisi magna sed dui. Fusce aliquam, enim",78653,11844,2015-03-07,24500,Proin,"2015-11-20 ",2016-03-14,27365,2016-05-05,2016-07-25,2016-07-02,Talon,Ross,"Ap #818-6630 Molestie. Ave",Mona,Cardenas,"Ap #383-7519 Molestie Avenue","V8D 9Z2",3,1,72,"V8D 9Z2",2016-07-02,2016-07-02,3,3,Mona,Staff
73,Lucas,Honorato,Julian,Yen,"Ap #112-8856 Ridiculus Av.","436-4458 Arcu. Avenue",Female,2014-12-01,21771-833,"ac urna. Ut tincidunt vehicula risus. Nulla eget metus eu",3,B638BBFF-CC3C-050B-472D-B0130669398D,4754,Google,"Customer Relations",TR928975882421635049082494,"Quality Assurance","nunc est, mollis non, cursus non, egestas a, dui. Cras",62945,96078,2015-03-27,69878,"porttitor tellus non magna.","2016-03-03 ",2015-10-08,53392,2015-07-14,2015-11-23,2016-10-24,Wang,Peter,"4191 Ridiculus Rd.",Scarlet,Head,"173-1509 Interdum St.","S3I 3N7",3,1,73,"S3I 3N7",2016-10-24,2016-10-24,3,3,Scarlet,Staff
74,Neville,Kenneth,Jin,Destiny,"2756 Id Rd.","Ap #419-9981 Curabitur Rd.",Male,2015-07-17,538,"nec, leo. Morbi neque tellus, imperdiet non, vestibulum nec, euismod",6,A8175CE6-0E94-9580-80AF-24D7DCD7EBBD,89363,Adobe,Payroll,BA768693084086412719,"Media Relations","ante dictum cursus. Nunc mauris elit, dictum eu, eleifend nec,",50015,30207,2015-11-15,79912,"Phasellus dolor elit, pellentesque a, facilisis non,","2015-12-16 ",2016-10-04,52906,2014-12-26,2015-04-08,2015-08-02,Kathleen,Dustin,"632-8458 Adipiscing Avenue",Brett,Randall,"3586 Enim Avenue","D2V 3Z5",5,1,74,"D2V 3Z5",2015-08-02,2015-08-02,5,5,Brett,Staff
75,Talon,Lawrence,Colton,Savannah,"Ap #491-3382 Nunc St.","900-5509 Ligula. Rd.",Female,2016-05-26,7568,"purus. Nullam scelerisque neque sed sem egestas blandit. Nam nulla",2,63560EC4-4A20-672C-CD19-F18B682AA5C8,18353,Altavista,"Sales and Marketing",MT33NLVF53580857378968655149489,Advertising,"dolor elit, pellentesque a, facilisis non, bibendum sed, est. Nunc",90866,28579,2015-11-09,83659,"parturient montes, nascetur ridiculus mus. Proin","2015-02-21 ",2015-09-18,10558,2016-10-01,2015-10-07,2015-02-27,Lev,Kenneth,"7516 Elit, Street",Colin,Vance,"P.O. Box 685, 2858 Nulla Ave","E9I 5M4",5,1,75,"E9I 5M4",2015-02-27,2015-02-27,5,5,Colin,Staff
76,Sawyer,Robert,Jasper,Cecilia,"619 Semper, St.","1484 Sed Road",Male,2016-08-14,0021DN,"imperdiet nec, leo. Morbi neque tellus, imperdiet non, vestibulum nec,",10,3B4DF893-D1BE-8451-7890-B8D5F01AF434,29425,Lycos,"Asset Management",IE71MNEH46238093796005,"Quality Assurance","eu dolor egestas rhoncus. Proin nisl sem, consequat nec, mollis",84042,72286,2016-10-20,25416,"lorem tristique aliquet. Phasellus","2015-08-20 ",2015-11-24,53090,2016-01-08,2015-06-18,2015-11-26,September,Neil,"P.O. Box 942, 2482 Duis Road",Uriel,Cote,"Ap #791-2766 Morbi St.","G4L 8Q4",4,2,76,"G4L 8Q4",2015-11-26,2015-11-26,4,4,Uriel,Staff
77,Chadwick,Galvin,Vladimir,Rama,"Ap #449-4462 Non Rd.","P.O. Box 934, 7813 Dolor Street",Male,2016-02-20,"V55 4BW","risus. Nulla eget metus eu erat semper rutrum. Fusce dolor",9,5374599E-D440-9697-9BEA-047AD23D2F2C,35924,Lycos,"Media Relations",TN7897836481486314153643,"Quality Assurance","posuere cubilia Curae; Phasellus ornare. Fusce mollis. Duis sit amet",28542,31622,2016-04-29,68039,"nunc sit amet metus. Aliquam erat","2015-05-09 ",2015-09-25,69923,2016-07-06,2016-01-31,2016-01-29,Samantha,Walter,"Ap #127-5646 Dictum St.",Giacomo,Barker,"Ap #495-5977 A, Rd.","K6Y 4Q7",3,1,77,"K6Y 4Q7",2016-01-29,2016-01-29,3,3,Giacomo,Staff
78,Valentine,Marsden,Ross,Xena,"3310 Iaculis Road","386-4197 Nisi. Rd.",Male,2015-06-27,423229,"orci luctus et ultrices posuere cubilia Curae; Donec tincidunt. Donec",4,84A6C207-625E-6697-157A-BDF1504014B9,74777,Google,"Public Relations",BE78144226048322,"Legal Department","nec, cursus a, enim. Suspendisse aliquet, sem ut cursus luctus,",74115,8020,2016-05-25,18513,"nonummy. Fusce fermentum fermentum arcu. Vestibulum ante ipsum primis","2016-08-19 ",2016-03-19,78885,2016-08-06,2015-07-20,2015-05-25,Akeem,Merritt,"Ap #879-8090 Sagittis Road",Lacy,Lawrence,"725-1603 Magna Road","T1K 7P2",3,1,78,"T1K 7P2",2015-05-25,2015-05-25,3,3,Lacy,Staff
