"id","name","name_english","father","mother","present_address","permanent_address","gender","dob","zip_code","registration_certificate_subject","registration_exam_year","registration_cetificate_no","index_no","bank_name","bank_branch","bank_account_no","designation","subject","monthly_salary_govt_provided","monthly_salary_institute_provided","gb_resolution_receive_date","gb_resolution_agenda_no","circular_paper_name","circular_published_date","recruit_approve_gbresolution_date","recruit_permit_agenda_no","recruitment_date","present_institute_join_date","present_post_join_date","dg_representative_name","dg_representative_designation","dg_representative_address","board_representative_name","board_representative_designation","board_representative_address","salary_code","manager_id","institute_id","user_id","salary_scale","recruit_exam_receive_date","time_scale_gbresolution_date","total_job_duration","current_position_job_duration","circular_paper_name","category"
79,Norman,Abdul,Nathan,Suki,"6182 Nostra, Avenue","845-6669 Duis Street",Male,2014-12-22,55827,"penatibus et magnis dis parturient montes, nascetur ridiculus mus. Donec",9,D0DFD967-628B-EA19-680D-85D0BCC43B05,96131,Chami,"Public Relations",RO06IBIJ4212866746855900,Payroll,"pretium aliquet, metus urna convallis erat, eget tincidunt dui augue",59272,16276,2016-04-27,62830,"aliquam arcu. Aliquam",2015-03-21,2016-03-14,96775,2015-12-14,2016-10-16,2016-08-27,Malcolm,Ray,"P.O. Box 521, 4767 Pede. Road",Brett,Hinton,"Ap #423-8920 Augue. Rd.","R4U 8W7",2,1,79,"R4U 8W7",2016-08-27,2016-08-27,2,2,Brett,Staff
80,Castor,Sebastian,Drew,Quon,"6523 Aliquam Rd.","983-9792 Phasellus Street",Male,2015-10-17,01440-139,"fringilla cursus purus. Nullam scelerisque neque sed sem egestas blandit.",7,A8C9DC5B-AF2E-1F34-19AB-DF89C326C3B5,58292,Adobe,"Human Resources",LB69480093225412940102234532,"Quality Assurance","Fusce feugiat. Lorem ipsum dolor sit amet, consectetuer adipiscing elit.",25226,99022,2016-08-03,39508,"euismod ac,",2014-12-17,2016-08-02,28533,2015-07-05,2016-07-29,2016-05-06,Kirestin,Alan,"Ap #239-1402 Purus Street",Clio,Carver,"195-3211 Blandit Ave","B4V 5Q0",2,2,80,"B4V 5Q0",2016-05-06,2016-05-06,2,2,Clio,Staff
81,Phelan,Callum,Howard,Madaline,"P.O. Box 946, 6795 Sit St.","5143 Duis Road",Female,2015-09-22,43312,"Mauris vestibulum, neque sed dictum eleifend, nunc risus varius orci,",7,4ED1B751-353F-F1FA-B1B7-223CAB16E16B,64731,Lavasoft,"Quality Assurance",BG62MAZW80242904923549,"Human Resources","lectus justo eu arcu. Morbi sit amet massa. Quisque porttitor",12246,74058,2015-02-04,92365,"Cras pellentesque. Sed","2016-05-25 ",2014-11-23,72723,2015-08-16,2014-12-04,2016-10-06,Sierra,Addison,"P.O. Box 323, 7494 Elit, Road",Garth,Davis,"P.O. Box 843, 1503 Cursus Rd.","D3M 2L3",5,1,81,"D3M 2L3",2016-10-06,2016-10-06,5,5,Garth,Staff
82,Paki,Duncan,Rahim,Sybil,"Ap #148-2247 Risus Rd.","7248 Mauris. Rd.",Female,2015-05-18,2372JW,"sodales. Mauris blandit enim consequat purus. Maecenas libero est, congue",7,D9CF86F6-C000-00DA-7DAD-D253678CBC60,78301,Altavista,Finances,HR2558870789619501772,"Research and Development","Vestibulum accumsan neque et nunc. Quisque ornare tortor at risus.",57159,11706,2016-07-11,9547,"nunc. In at pede. Cras vulputate velit eu sem. Pellentesque","2015-04-19 ",2016-03-10,71920,2015-01-17,2016-06-21,2015-03-16,Deanna,Kareem,"Ap #337-7933 Convallis Av.",Marah,Perry,"612 Libero Av.","R5D 9M1",2,1,82,"R5D 9M1",2015-03-16,2015-03-16,2,2,Marah,Staff
83,Scott,Lee,Alan,Nichole,"4146 Nam Rd.","Ap #337-4582 Augue Road",Male,2014-12-04,20841,"tristique ac, eleifend vitae, erat. Vivamus nisi. Mauris nulla. Integer",10,DCB3B26F-5676-C28A-79E7-F3653A96AEEF,44561,Adobe,"Research and Development",MC2932721085577404456600200,Accounting,"enim. Etiam imperdiet dictum magna. Ut tincidunt orci quis lectus.",19634,71612,2015-10-09,78725,"iaculis odio. Nam interdum enim non nisi. Aenean eget","2016-06-12 ",2016-01-29,79905,2015-02-22,2016-08-23,2016-01-25,Moana,Keefe,"9066 Curabitur Road",Kieran,Barr,"Ap #589-8233 Donec Ave","S5R 9A0",2,2,83,"S5R 9A0",2016-01-25,2016-01-25,2,2,Kieran,Staff
84,Finn,Quentin,Gil,Blaine,"489-481 Cubilia Road","4269 Morbi Av.",Male,2014-11-26,50300-765,"Nunc ut erat. Sed nunc est, mollis non, cursus non,",3,2118367A-DE14-68C3-72BE-4A801AB54A18,66416,Lavasoft,"Human Resources",NO5587368974295,"Research and Development","elit, dictum eu, eleifend nec, malesuada ut, sem. Nulla interdum.",10217,40916,2016-09-09,48092,"ac urna.","2015-12-12 ",2016-03-15,80360,2015-09-21,2016-09-09,2016-05-25,Petra,Baker,"6591 Sapien. Rd.",Stacey,Burton,"P.O. Box 624, 3937 Augue St.","E8X 3V9",2,1,84,"E8X 3V9",2016-05-25,2016-05-25,2,2,Stacey,Staff
85,Graiden,Rahim,Tyler,Alice,"539-2850 Turpis Ave","Ap #603-7919 Cursus Rd.",Male,2016-04-06,1631,"egestas. Fusce aliquet magna a neque. Nullam ut nisi a",8,5037F638-68A2-BB26-F145-53D52EEF8F7B,80387,Cakewalk,Finances,AZ21730489420644682362931879,Finances,"nec luctus felis purus ac tellus. Suspendisse sed dolor. Fusce",26946,97540,2015-06-19,14716,"est,","2015-05-20 ",2016-09-23,49484,2016-03-20,2015-01-18,2015-03-28,Victor,Jonas,"P.O. Box 271, 7648 Egestas. St.",Hayden,Stevenson,"117-5504 Nulla Rd.","D7D 1W2",4,1,85,"D7D 1W2",2015-03-28,2015-03-28,4,4,Hayden,Staff
86,Lev,Coby,Yasir,Kevyn,"P.O. Box 409, 3622 Tempus Ave","534-7142 Lorem, Av.",Female,2016-05-20,486321,"malesuada fames ac turpis egestas. Fusce aliquet magna a neque.",2,DB4405A2-AAB1-FC7B-0A73-5D336AF5F02C,58732,Borland,"Legal Department",GL2373240109916690,"Research and Development","Duis mi enim, condimentum eget, volutpat ornare, facilisis eget, ipsum.",88875,33229,2016-10-27,69728,"Donec sollicitudin adipiscing ligula.","2016-10-22 ",2015-06-17,53334,2015-04-11,2016-05-24,2015-05-20,Eve,Clinton,"3490 Tempor Ave",Kylie,Gilbert,"638-2048 Justo. St.","K9I 8A1",4,1,86,"K9I 8A1",2015-05-20,2015-05-20,4,4,Kylie,Staff
87,Alden,Carson,Palmer,Illana,"112-7584 Phasellus St.","853-7939 Tristique St.",Female,2016-08-03,10329,"ut dolor dapibus gravida. Aliquam tincidunt, nunc ac mattis ornare,",9,298C10E8-6D93-9EDF-55C8-849A4A0CC19D,11074,"Apple Systems","Quality Assurance",SA4255096395891629210884,Finances,"lacus. Quisque purus sapien, gravida non, sollicitudin a, malesuada id,",49800,54460,2015-11-04,46587,"sed, hendrerit a, arcu. Sed et libero. Proin","2015-06-03 ",2016-01-23,2618,2015-01-05,2015-05-08,2015-08-24,Hiroko,Hammett,"1293 Dictum Rd.",Zia,Hensley,"P.O. Box 984, 159 Sodales Av.","I6A 0Q4",3,2,87,"I6A 0Q4",2015-08-24,2015-08-24,3,3,Zia,Staff
88,Octavius,Wayne,Beck,Shannon,"P.O. Box 492, 1437 Rhoncus. St.","2963 Posuere Rd.",Female,2015-12-01,"Q18 9WP","auctor vitae, aliquet nec, imperdiet nec, leo. Morbi neque tellus,",6,3858E24C-7446-9F16-BD54-7D6BF6AD6020,86453,Altavista,"Customer Relations",GL5889260029370339,"Customer Service","quam quis diam. Pellentesque habitant morbi tristique senectus et netus",2308,73980,2016-05-22,27294,"mus. Proin vel arcu eu odio",2015-06-15,2016-07-06,83060,2015-09-13,2015-02-10,2016-07-11,Quyn,Alden,"5654 In, Av.",Aurelia,Miranda,"2336 Purus Av.","V4I 7Q8",3,2,88,"V4I 7Q8",2016-07-11,2016-07-11,3,3,Aurelia,Staff
89,Jelani,Preston,Lester,Summer,"6084 Sapien, Rd.","4661 Egestas Road",Male,2016-06-18,1376,"sodales at, velit. Pellentesque ultricies dignissim lacus. Aliquam rutrum lorem",2,7A09435D-E8D8-F4E7-F3A0-C6740D0872E2,30474,Lycos,"Customer Relations",SK4485002174765994630567,Accounting,"eleifend vitae, erat. Vivamus nisi. Mauris nulla. Integer urna. Vivamus",41945,25635,2015-05-28,54888,"dapibus rutrum, justo. Praesent luctus. Curabitur egestas nunc sed libero.","2016-05-20 ",2015-11-11,43498,2014-12-29,2016-10-17,2015-04-14,Brenna,Gabriel,"Ap #973-9486 Tempor Road",Demetria,Huff,"Ap #558-9432 Nulla Av.","H4C 4W8",2,1,89,"H4C 4W8",2015-04-14,2015-04-14,2,2,Demetria,Staff
90,Wade,Forrest,Fulton,Sage,"592-4218 Aliquet Avenue","Ap #484-4536 Bibendum. Ave",Male,2015-01-15,6989,"non, luctus sit amet, faucibus ut, nulla. Cras eu tellus",1,38E0F8A9-F01E-740F-9A3E-C0123D455FDD,67490,Yahoo,"Research and Development",CR9112689132259178979,"Media Relations","sagittis augue, eu tempor erat neque non quam. Pellentesque habitant",8872,38611,2016-10-01,71240,"Aliquam gravida","2016-03-29 ",2015-05-16,22832,2015-12-04,2015-08-04,2016-10-13,Willa,Allistair,"536-6865 Fermentum Rd.",Chiquita,Vincent,"220-3580 Eleifend Av.","G6D 5J0",3,2,90,"G6D 5J0",2016-10-13,2016-10-13,3,3,Chiquita,Staff
91,Hayden,William,Drew,Kerry,"7692 Euismod Road","776-8065 Amet Rd.",Female,2015-02-22,71850,"nonummy. Fusce fermentum fermentum arcu. Vestibulum ante ipsum primis in",5,566E3C9D-41C9-9B99-145B-F3561D66B7FA,82861,Lycos,Advertising,PS706047039871153433977318457,Finances,"fringilla, porttitor vulputate, posuere vulputate, lacus. Cras interdum. Nunc sollicitudin",8011,31836,2016-10-05,4863,"diam. Proin dolor. Nulla semper","2015-08-02 ",2015-10-11,29730,2015-07-09,2016-03-29,2015-06-23,Shad,Perry,"456-2447 Volutpat Rd.",Brenda,Lindsay,"6765 Aliquam Rd.","Q9F 3F2",3,1,91,"Q9F 3F2",2015-06-23,2015-06-23,3,3,Brenda,Teacher
92,Trevor,Mannix,Oliver,Sonia,"P.O. Box 821, 5656 Lobortis Road","P.O. Box 795, 2153 Morbi Street",Male,2015-11-30,88-836,"mi lacinia mattis. Integer eu lacus. Quisque imperdiet, erat nonummy",4,5967119D-42C2-1BF5-A591-048FA4EC91E6,14157,Macromedia,"Customer Service",MD5203249722332342871987,Payroll,"Vestibulum ut eros non enim commodo hendrerit. Donec porttitor tellus",67715,36738,2016-11-04,17990,"mollis. Integer tincidunt aliquam arcu. Aliquam","2016-02-26 ",2016-02-27,44533,2016-09-27,2015-09-19,2015-02-06,Piper,Gavin,"468-6650 Lorem St.",Dane,Burgess,"Ap #993-1724 Amet St.","S7Y 5G0",3,2,92,"S7Y 5G0",2015-02-06,2015-02-06,3,3,Dane,Teacher
93,Demetrius,Talon,Brady,Myra,"5125 Cursus St.","1183 Nunc St.",Male,2015-06-24,196325,"at augue id ante dictum cursus. Nunc mauris elit, dictum",10,CAC337DD-42D8-C67A-78ED-F8E980BE93D3,16639,Finale,Advertising,IT885PYFDI71677644961255439,"Public Relations","cursus purus. Nullam scelerisque neque sed sem egestas blandit. Nam",14421,25222,2016-05-14,1405,"egestas. Fusce aliquet magna","2015-01-02 ",2016-01-26,71936,2015-12-28,2015-11-23,2016-07-23,Samson,Uriel,"Ap #412-3530 Sed, Ave",Rhiannon,Alston,"Ap #300-759 Erat Ave","E3E 1E7",5,1,93,"E3E 1E7",2016-07-23,2016-07-23,5,5,Rhiannon,Teacher
94,Carlos,Grady,Micah,Alexa,"449-407 Felis St.","Ap #129-591 Orci Av.",Female,2014-12-29,50799,"Nam tempor diam dictum sapien. Aenean massa. Integer vitae nibh.",8,422DB47D-856E-C081-F688-4FF767DE9828,6588,Altavista,Payroll,SA2481612561530525061118,"Human Resources","non arcu. Vivamus sit amet risus. Donec egestas. Aliquam nec",84302,28759,2016-10-31,73004,"Nulla interdum. Curabitur dictum. Phasellus in felis. Nulla tempor","2015-09-16 ",2016-03-27,24965,2016-08-31,2015-01-24,2016-04-16,Jael,Colorado,"4559 Pede. St.",Joel,Bridges,"Ap #750-9494 Nonummy. Rd.","N5K 1N2",5,1,94,"N5K 1N2",2016-04-16,2016-04-16,5,5,Joel,Teacher
95,James,Tate,Kasper,Pandora,"Ap #889-3894 Fermentum Ave","P.O. Box 254, 4609 Rutrum. Rd.",Female,2016-07-22,"TN1 7EH","cursus in, hendrerit consectetuer, cursus et, magna. Praesent interdum ligula",2,7C0479B1-4FEE-718D-2210-4C281A48DCB5,87629,Chami,Payroll,PT30274794496368972659964,"Customer Service","diam. Duis mi enim, condimentum eget, volutpat ornare, facilisis eget,",15490,25386,2016-08-23,85419,dignissim,"2015-08-31 ",2016-04-07,22289,2015-03-22,2014-11-10,2014-11-14,Clark,Ishmael,"853-1747 Nisi. Avenue",Kay,Hill,"P.O. Box 648, 8573 Mauris Rd.","J1K 3F6",4,2,95,"J1K 3F6",2014-11-14,2014-11-14,4,4,Kay,Teacher
96,Isaac,Jasper,Conan,Julie,"640-4094 Iaculis Rd.","P.O. Box 689, 6192 Et, St.",Female,2015-01-04,25599,"ac turpis egestas. Fusce aliquet magna a neque. Nullam ut",8,CB987970-0B21-9F5C-BA11-3411C6CB956E,43372,Altavista,"Customer Service",PK6252134612446453758931,Payroll,"at pede. Cras vulputate velit eu sem. Pellentesque ut ipsum",31559,76119,2015-06-17,32372,"auctor velit.","2015-12-07 ",2015-02-14,74337,2015-06-09,2014-11-24,2016-04-25,Ignatius,Jesse,"9220 Vivamus Street",Gavin,Warner,"184-6402 Vulputate Rd.","W1X 6Q2",3,2,96,"W1X 6Q2",2016-04-25,2016-04-25,3,3,Gavin,Teacher
97,Dante,Hoyt,Zane,Candace,"1248 Scelerisque Ave","912-245 A Road",Male,2014-12-29,89258,"est. Nunc ullamcorper, velit in aliquet lobortis, nisi nibh lacinia",8,1647366B-5A66-CB02-C78E-584F4232C48B,63144,Macromedia,"Customer Relations",GL5375874846270382,"Asset Management","enim. Sed nulla ante, iaculis nec, eleifend non, dapibus rutrum,",45809,41978,2014-11-29,12468,"sem, vitae aliquam eros","2015-12-16 ",2015-11-18,23043,2016-01-06,2016-01-16,2015-05-06,Kyle,Jameson,"180-6950 Aliquam Street",Wallace,Salinas,"180-3519 Maecenas Rd.","P8L 9R5",3,1,97,"P8L 9R5",2015-05-06,2015-05-06,3,3,Wallace,Teacher
98,Neil,Ashton,Victor,Colette,"724-4215 Sem Avenue","P.O. Box 784, 9453 Consequat Avenue",Female,2015-03-22,60506,"nisi a odio semper cursus. Integer mollis. Integer tincidunt aliquam",5,5B4546B6-2D0F-23F8-0087-B076F7E342F3,79817,Lycos,"Legal Department",LI6703896710947030841,"Human Resources","nisi. Aenean eget metus. In nec orci. Donec nibh. Quisque",69932,20628,2015-05-05,68881,"varius ultrices, mauris ipsum porta","2016-04-30 ",2016-08-31,422,2016-01-17,2015-11-04,2016-10-19,Maia,Giacomo,"Ap #585-8159 Massa. St.",Malachi,Acosta,"P.O. Box 433, 9581 Facilisis Street","B2S 1C2",2,1,98,"B2S 1C2",2016-10-19,2016-10-19,2,2,Malachi,Teacher
99,Amal,Sawyer,Caleb,Lacy,"1695 Erat St.","4671 Metus Rd.",Female,2014-12-02,3490,"lobortis, nisi nibh lacinia orci, consectetuer euismod est arcu ac",9,FC476D7F-FD0F-36D0-2638-3908D5662D18,34291,Macromedia,"Customer Service",BA719747511871825401,Payroll,"ut dolor dapibus gravida. Aliquam tincidunt, nunc ac mattis ornare,",41050,90025,2016-09-27,98272,"dui, nec tempus mauris erat eget ipsum.","2016-06-17 ",2016-06-01,90734,2015-09-07,2014-11-11,2015-06-08,Sasha,Simon,"8101 Luctus Avenue",Idola,Michael,"892-4548 Non, Avenue","K6O 5N0",2,1,99,"K6O 5N0",2015-06-08,2015-06-08,2,2,Idola,Teacher
100,Matthew,Ciaran,Kieran,Indigo,"P.O. Box 821, 3641 Massa St.","Ap #780-2771 Integer Road",Female,2015-01-08,6522,"adipiscing lobortis risus. In mi pede, nonummy ut, molestie in,",2,0D19E657-2F84-B19F-FF44-712B6E0A4F4E,42858,Microsoft,"Legal Department",VG1869272521887793823673,"Tech Support","mi lacinia mattis. Integer eu lacus. Quisque imperdiet, erat nonummy",36070,26345,2016-10-15,63090,"felis. Nulla tempor augue ac ipsum.","2015-06-21 ",2016-09-01,9496,2015-03-05,2016-10-31,2015-12-20,Keiko,Kibo,"Ap #119-7436 Quam Rd.",Eaton,Bowers,"3657 Sollicitudin St.","Q3R 7E4",5,1,100,"Q3R 7E4",2015-12-20,2015-12-20,5,5,Eaton,Teacher
